Page,Text
Page 1,Sample PDFThis is a simple PDF ﬁle
Page 1,Fun fun fun
Page 1,"Lorem ipsum dolor sit amet, consectetuer adipiscing elit"
Page 1,Phasellus facilisis odio sed mi
Page 1,Curabitur suscipit
Page 1,Nullam vel nisi
Page 1,Etiam semper ipsum ut lectus
Page 1,"Proin aliquam, erat eget pharetra commodo, eros mi condimentum quam, sed commodo justo quam ut velit"
Page 1,Integer a erat
Page 1,Cras laoreet ligula cursus enim
Page 1,Aenean scelerisque velit et tellus
Page 1,Vestibulum dictum aliquet sem
Page 1,Nulla facilisi
Page 1,Vestibulum accumsan ante vitae elit
Page 1,"Nulla erat dolor, blandit in, rutrum quis, semper pulvinar, enim"
Page 1,Nullam varius congue risus
Page 1,"Vivamus sollicitudin, metus ut interdum eleifend, nisi tellus pellentesque elit, tristique accumsan eros quam et risus"
Page 1,"Suspendisse libero odio, mattis sit amet, aliquet eget, hendrerit vel, nulla"
Page 1,Sed vitae augue
Page 1,Aliquam erat volutpat
Page 1,Aliquam feugiat vulputate nisl
Page 1,Suspendisse quis nulla pretium ante pretium mollis
Page 1,"Proin velit ligula, sagittis at, egestas a, pulvinar quis, nisl"
Page 1,Pellentesque sit amet lectus
Page 1,"Praesent pulvinar, nunc quis iaculis sagittis, justo quam lobortis tortor, sed vestibulum dui metus venenatis est"
Page 1,Nunc cursus ligula
Page 1,Nulla facilisi
Page 1,Phasellus ullamcorper consectetuer ante
Page 1,"Duis tincidunt, urna id condimentum luctus, nibh ante vulputate sapien, id sagittis massa orci ut enim"
Page 1,Pellentesque vestibulum convallis sem
Page 1,Nulla consequat quam ut nisl
Page 1,Nullam est
Page 1,Curabitur tincidunt dapibus lorem
Page 1,"Proin velit turpis, scelerisque sit amet, iaculis nec, rhoncus ac, ipsum"
Page 1,"Phasellus lorem arcu, feugiat eu, gravida eu, consequat molestie, ipsum"
Page 1,Nullam vel est ut ipsum volutpat feugiat
Page 1,Aenean pellentesque
Page 1,In mauris
Page 1,"Pellentesque dui nisi, iaculis eu, rhoncus in, venenatis ac, ante"
Page 1,"Ut odio justo, scelerisque vel, facilisis non, commodo a, pede"
Page 1,Cras nec massa sit amet tortor volutpat varius
Page 1,"Donec lacinia, neque a luctus aliquet, pede massa imperdiet ante, at varius lorem pede sed sapien"
Page 1,"Fusce erat nibh, aliquet in, eleifend eget, commodo eget, erat"
Page 1,Fusce consectetuer
Page 1,"Cras risus tortor, porttitor nec, tristique sed, convallis semper, eros"
Page 1,Fusce vulputate ipsum a mauris
Page 1,Phasellus mollis
Page 1,Curabitur sed urna
Page 1,Aliquam nec sapien non nibh pulvinar convallis
Page 1,Vivamus facilisis augue quis quam
Page 1,Proin cursus aliquet metus
Page 1,Suspendisse lacinia
Page 1,Nulla at tellus ac turpis eleifend scelerisque
Page 1,Maecenas a pede vitae enim commodo interdum
Page 1,Donec odio
Page 1,Sed sollicitudin dui vitae justo
Page 1,"Morbi elit nunc, facilisis a, mollis a, molestie at, lectus"
Page 1,Suspendisse eget mauris eu tellus molestie cursus
Page 1,Duis ut magna at justo dignissim condimentum
Page 1,"Cum sociis natoque penatibus et magnis dis parturient montes, nascetur ridiculus mus"
Page 1,Vivamus varius
Page 1,Ut sit amet diam suscipit mauris ornare aliquam
Page 1,Sed varius
Page 1,Duis arcu
Page 1,Etiam tristique massa eget dui
Page 1,Phasellus congue
Page 1,"Aenean est erat, tincidunt eget, venenatis quis, commodo at, quam"
